<?xml version="1.0" encoding="UTF-8" ?>
<payment
        xmlns:xsi="http://www.w3.org/2001/XMLSchema-instance"
        xsi:schemaLocation="http://by.it.shelkovich/payment data.xsd"
        xmlns="http://by.it.shelkovich/payment"
>
    <payer>
        <name>Alexander Druz</name>
        <email>druz@chtogdekogda.ru</email>
    </payer>
    <order id="4519">
        <date>1510997912231</date>
        <shippingPrice>200</shippingPrice>
        <products>
            <product>
                <productName>Baraban&amp;"MM's</productName>
                <price>6000</price>
            </product>
            <product>
                <productName>Volchok</productName>
                <price>1000</price>
            </product>
        </products>
    </order>
</payment>